<?xml version="1.0" encoding="UTF-8"?>
<dataroot xmlns:od="urn:schemas-microsoft-com:officedata" xmlns:xsi="http://www.w3.org/2001/XMLSchema-instance"  xsi:noNamespaceSchemaLocation="Texperiments.xsd" generated="2020-01-12T15:43:30">
<Texperiments>
<ID>1</ID>
<Experiment_x0020_Name>test1</Experiment_x0020_Name>
<Experiment_x0020_Details>rand</Experiment_x0020_Details>
<Dat>2019-10-19T00:00:00</Dat>
</Texperiments>
<Texperiments>
<ID>2</ID>
<Experiment_x0020_Name>test2</Experiment_x0020_Name>
<Experiment_x0020_Details>ravd2</Experiment_x0020_Details>
<Dat>2019-10-04T00:00:00</Dat>
</Texperiments>
<Texperiments>
<ID>3</ID>
<Experiment_x0020_Name>test3</Experiment_x0020_Name>
<Experiment_x0020_Details>asdasdg</Experiment_x0020_Details>
<Dat>2019-10-05T00:00:00</Dat>
</Texperiments>
</dataroot>
